{
  "id": "dai-xiang",
  "name": "戴向",
  "generation": null,
  "generationIndex": 8,
  "bio": "相声门传承人物。报道将其列为杨振华弟子，相关身份与阅读范围见出处。",
  "works": [],
  "sources": [
    "src-sparse-yang-dai"
  ],
  "portraitKind": "placeholder",
  "notes": [
    "资料未独立确认正式字辈；图中层级仅用于展示，不作宗谱辈分认定。"
  ],
  "aliases": [
    "盛京小媄"
  ]
}
