{
  "id": "zhang-yongxi",
  "name": "张永熙",
  "generation": null,
  "generationIndex": 7,
  "bio": "南京相声表演艺术家。现代快报现场记录其2007年收徒仪式，保留独立地域分支；上游师承需另行独立核验。",
  "works": [],
  "sources": [
    "src-sparse-nanjing-2007"
  ],
  "portraitKind": "placeholder",
  "notes": [
    "资料未独立确认正式字辈；图中层级仅用于展示，不作宗谱辈分认定。"
  ]
}
