{
  "id": "liu-erjin",
  "name": "刘尔金",
  "generation": null,
  "generationIndex": 8,
  "bio": "台湾相声及表演艺术工作者，1999年拜吴兆南，传艺中心合照列为第五徒。",
  "works": [],
  "sources": [
    "src-ncfta-wu-disciples",
    "src-nccu-crosstalk-2012"
  ],
  "portraitKind": "placeholder",
  "nameHant": "劉爾金",
  "notes": [
    "未独立核定正式字辈，展示层级不作宗谱辈分认定。"
  ]
}
