{
  "id": "ma-heqi",
  "name": "马鹤琪",
  "generation": null,
  "generationIndex": 9,
  "school": "德云社鹤字科",
  "bio": "相声演员，师承郭德纲，后续在外地发展。",
  "works": [],
  "sources": [
    "src-ifeng-guo-genealogy-2016"
  ],
  "portraitKind": "placeholder",
  "disputed": false,
  "notes": [
    "德云社名单中见，当前在外地发展。"
  ]
}
