{
  "id": "hua-ziyuan",
  "name": "华子元",
  "generation": "德",
  "generationIndex": 4,
  "school": "恩绪门下",
  "bio": "恩绪弟子，又名华德茂，曾在北京表演单口相声戏迷传；未据去世年代推定具体卒年。",
  "works": [
    "戏迷传"
  ],
  "sources": [
    "src-wiki-lineage",
    "src-chaoxing-liuhuo"
  ],
  "portraitKind": "placeholder",
  "aliases": [
    "华德茂"
  ]
}
