{
  "id": "wang-jindong",
  "name": "王金东",
  "generation": "文",
  "generationIndex": 7,
  "school": "马志明门下（未确认）",
  "bio": "相声演员。该名字在公开短视频中出现过于马志明口径下的“活动名义挂名”记载，未见独立摆知或正式记名材料，作为非正式待核人物单独保留。",
  "works": [],
  "sources": ["src-douyin-ma-rejected-disciples"],
  "portraitKind": "placeholder",
  "disputed": true,
  "notes": [
    "按当前规则：口头约定、活动名义挂名不列正式入室弟子。"
  ]
}
