{
  "id": "yang-zhenhua",
  "name": "杨振华",
  "generation": null,
  "generationIndex": 7,
  "bio": "1936年生于沈阳，活跃于辽沈相声舞台。1957年拜杨海荃为师；曾与金炳昶搭档，师承与合作分别记录。2026年1月逝世。",
  "works": [
    "假大空",
    "好梦不长",
    "下棋"
  ],
  "sources": [
    "src-lnr-yang-obit-2026",
    "src-sparse-yang-2022",
    "src-sparse-yang-2020",
    "src-sparse-yang-dai",
    "src-sparse-yang-guan",
    "src-sparse-yang-li"
  ],
  "portraitKind": "placeholder",
  "birthYear": 1936,
  "deathYear": 2026,
  "school": "辽沈",
  "notes": [
    "本次资料未确认正式字辈；图中层级仅用于展示，不作宗谱辈分认定。"
  ]
}
