{
  "id": "guan-jiuhai",
  "name": "关九海",
  "generation": null,
  "generationIndex": 9,
  "school": "德云社九字科",
  "bio": "关九海，相声演员，见于郭德纲门下对应科别名录。",
  "works": [],
  "sources": [
    "src-ifeng-guo-genealogy-2016"
  ],
  "portraitKind": "placeholder",
  "notes": [
    "德云社师承分类：在职。"
  ],
  "aliases": [
    "关思宇"
  ]
}
