{
  "id": "han-laoda",
  "name": "韩劳达",
  "generation": null,
  "generationIndex": 8,
  "bio": "新加坡相声创作者及推广者，本名韩永元、笔名谭天，参与创办新风相声学会。未核定正式本师。",
  "works": [
    "送票"
  ],
  "sources": [
    "src-sccc-han"
  ],
  "portraitKind": "placeholder",
  "aliases": [
    "韩永元",
    "谭天"
  ],
  "notes": [
    "未独立核定正式字辈，展示层级不作宗谱辈分认定。"
  ]
}
