{
  "id": "zhang-wenfu",
  "name": "张文甫",
  "generation": null,
  "generationIndex": 7,
  "school": "高派快板",
  "bio": "艺名张学桐。中国广播网2009年介绍其于1978年8月拜高凤山为师，学习高派快板。",
  "works": [],
  "sources": [
    "src-cnr-zhang-wenfu-20090722"
  ],
  "portraitKind": "placeholder",
  "aliases": [
    "张学桐"
  ],
  "notes": [
    "这里记录高派快板师承，不据此确认相声门字辈。与相声谱赵兰亭门下同名人物的身份关系尚需独立生平资料核对，不自动合并。"
  ]
}
