{
  "id": "li-jianhua",
  "name": "李建华",
  "generation": null,
  "generationIndex": 8,
  "bio": "相声门传承人物。报道将其列为唐杰忠弟子，相关身份与阅读范围见出处。",
  "works": [],
  "sources": [
    "src-sparse-tang-2009",
    "src-sparse-tang-liu-1988"
  ],
  "portraitKind": "placeholder",
  "notes": [
    "资料未独立确认正式字辈；图中层级仅用于展示，不作宗谱辈分认定。"
  ]
}
