{
  "id": "huang-jiaqiang",
  "name": "黄家强",
  "generation": null,
  "generationIndex": 9,
  "bio": "新加坡相声演员，2019年2月21日在北京正式拜姜昆为师。",
  "works": [],
  "sources": [
    "src-cover-jiang-overseas-2019",
    "src-sccc-xu-2022"
  ],
  "portraitKind": "placeholder",
  "nameHant": "黃家強",
  "notes": [
    "未独立核定正式字辈，展示层级不作宗谱辈分认定。",
    "新加坡相声演员，与香港同名音乐人分开。"
  ]
}
