{
  "id": "xiao-long-guo-zihao",
  "name": "小龙",
  "aliases": [
    "郭子豪"
  ],
  "generation": null,
  "generationIndex": 9,
  "school": "师承待核",
  "bio": "原目录收录于谦门下的说法；本轮尚未核实直接报道原文，正式师承与具体拜师形式待考。",
  "works": [],
  "sources": [
    "src-wiki-lineage"
  ],
  "portraitKind": "placeholder",
  "disputed": true,
  "notes": [
    "暂存原目录位置供核查，不将口盟、记名或拜师仪式的网络叙述写作定论。"
  ]
}
