{
  "id": "song-shaoqing",
  "name": "宋少卿",
  "generation": "文",
  "generationIndex": 7,
  "bio": "台湾相声演员，相声瓦舍共同创办人。2002年在北京拜常宝华为师，师承与剧场合作分别记录。",
  "works": [
    "东厂仅一位",
    "相声说垮鬼子们"
  ],
  "sources": [
    "src-wiki-song-2026"
  ],
  "portraitKind": "placeholder",
  "birthYear": 1967,
  "nameHant": "宋少卿"
}
