{
  "id": "tao-yunsheng",
  "name": "陶云圣",
  "generation": null,
  "generationIndex": 9,
  "school": "德云社云字科",
  "bio": "陶云圣，相声演员，见于郭德纲门下对应科别名录。",
  "works": [],
  "sources": [
    "src-ifeng-guo-genealogy-2016"
  ],
  "portraitKind": "placeholder",
  "notes": [
    "德云社师承分类：在职，麒麟剧社。"
  ],
  "aliases": [
    "陶阳"
  ]
}
