{
  "id": "song-ning",
  "portraitKind": "placeholder",
  "works": [],
  "sources": [
    "src-wiki-lineage",
    "src-huanqiu-songning-2002",
    "src-huanqiu-feng-gong-lineage"
  ],
  "name": "宋宁",
  "generationIndex": 9,
  "school": "北京马季门",
  "bio": "冯巩弟子（女），早年在央视节目中与师父同台多次。2002年拜师记录见环球网。",
  "disputed": false,
  "generation": null
}
