{
  "id": "hou-guanqun",
  "name": "侯冠群",
  "generation": null,
  "generationIndex": 8,
  "bio": "台湾相声及戏剧演员，吴兆南门下第二徒，机构节目列其参与吴门传承。",
  "works": [],
  "sources": [
    "src-ncfta-wu-disciples",
    "src-nccu-crosstalk-2012"
  ],
  "portraitKind": "placeholder",
  "nameHant": "侯冠群",
  "notes": [
    "未独立核定正式字辈，展示层级不作宗谱辈分认定。"
  ]
}
