{
  "id": "li-hedong",
  "name": "李鹤东",
  "generation": null,
  "generationIndex": 9,
  "school": "德云社鹤字科",
  "bio": "李鹤东，相声演员，见于郭德纲门下对应科别名录。",
  "works": [],
  "sources": [
    "src-ifeng-guo-genealogy-2016"
  ],
  "portraitKind": "placeholder",
  "notes": [
    "德云社师承分类：在职。"
  ],
  "aliases": [
    "李冬"
  ]
}
