{
  "id": "yu-yunting",
  "name": "于云霆",
  "generation": null,
  "generationIndex": 9,
  "school": "德云社云字科",
  "bio": "于云霆，相声演员，见于郭德纲门下对应科别名录。",
  "works": [],
  "sources": [
    "src-ifeng-guo-genealogy-2016"
  ],
  "portraitKind": "placeholder",
  "notes": [
    "德云社师承分类：在职，正式摆知（口盟阶段后转为正式）。"
  ],
  "aliases": [
    "于思洋",
    "于谦之子"
  ]
}
