{
  "id": "wu-fuxing",
  "name": "武福星",
  "generation": null,
  "generationIndex": 8,
  "bio": "相声门传承人物。报道将其列为苏文茂弟子，相关身份与阅读范围见出处。",
  "works": [],
  "sources": [
    "src-sparse-su-2008",
    "src-sparse-su-culture-2015"
  ],
  "portraitKind": "placeholder",
  "notes": [
    "资料未独立确认正式字辈；图中层级仅用于展示，不作宗谱辈分认定。"
  ]
}
